{
  "$schema": "https://json-schema.org/draft/2020-12/schema",
  "$id": "urn:model-skyline:schema:v1alpha1:selection-snapshot",
  "$defs": {
    "AxisEstimate": {
      "additionalProperties": false,
      "properties": {
        "value": {
          "maxLength": 1024,
          "pattern": "^[+-]?\\d+(?:\\.\\d+)?$",
          "title": "Value",
          "type": "string"
        },
        "unit": {
          "title": "Unit",
          "type": "string"
        },
        "evidence_tiers": {
          "default": [
            "measured"
          ],
          "items": {
            "$ref": "#/$defs/EvidenceTier"
          },
          "title": "Evidence Tiers",
          "type": "array"
        },
        "lower": {
          "anyOf": [
            {
              "maxLength": 1024,
              "pattern": "^[+-]?\\d+(?:\\.\\d+)?$",
              "type": "string"
            },
            {
              "type": "null"
            }
          ],
          "default": null,
          "title": "Lower"
        },
        "upper": {
          "anyOf": [
            {
              "maxLength": 1024,
              "pattern": "^[+-]?\\d+(?:\\.\\d+)?$",
              "type": "string"
            },
            {
              "type": "null"
            }
          ],
          "default": null,
          "title": "Upper"
        },
        "dependencies": {
          "default": [],
          "items": {
            "type": "string"
          },
          "title": "Dependencies",
          "type": "array"
        },
        "source_ids": {
          "default": [],
          "items": {
            "type": "string"
          },
          "title": "Source Ids",
          "type": "array"
        },
        "sources": {
          "default": [],
          "items": {
            "$ref": "#/$defs/SourceReference"
          },
          "title": "Sources",
          "type": "array"
        },
        "oldest_observed_at": {
          "anyOf": [
            {
              "format": "date-time",
              "type": "string"
            },
            {
              "type": "null"
            }
          ],
          "default": null,
          "title": "Oldest Observed At"
        },
        "minimum_sample_count": {
          "anyOf": [
            {
              "maximum": 9007199254740991,
              "minimum": 0,
              "type": "integer"
            },
            {
              "type": "null"
            }
          ],
          "default": null,
          "title": "Minimum Sample Count"
        }
      },
      "required": [
        "value",
        "unit"
      ],
      "title": "AxisEstimate",
      "type": "object",
      "allOf": [
        {
          "if": {
            "properties": {
              "evidence_tiers": {
                "contains": {
                  "const": "estimated"
                }
              }
            },
            "required": [
              "evidence_tiers"
            ]
          },
          "then": {
            "properties": {
              "lower": {
                "not": {
                  "type": "null"
                }
              },
              "upper": {
                "not": {
                  "type": "null"
                }
              }
            },
            "required": [
              "lower",
              "upper"
            ]
          }
        }
      ]
    },
    "EvidenceTier": {
      "description": "How directly an observation represents the declared metric.",
      "enum": [
        "proxy",
        "estimated",
        "measured"
      ],
      "title": "EvidenceTier",
      "type": "string"
    },
    "InsufficientCandidates": {
      "enum": [
        "error",
        "return_available"
      ],
      "title": "InsufficientCandidates",
      "type": "string"
    },
    "JsonValue": {},
    "ModelChoice": {
      "additionalProperties": false,
      "properties": {
        "offering": {
          "$ref": "#/$defs/OfferingKey"
        },
        "axes": {
          "additionalProperties": {
            "$ref": "#/$defs/AxisEstimate"
          },
          "title": "Axes",
          "type": "object"
        },
        "metadata": {
          "additionalProperties": {
            "$ref": "#/$defs/JsonValue"
          },
          "title": "Metadata",
          "type": "object"
        }
      },
      "required": [
        "offering",
        "axes"
      ],
      "title": "ModelChoice",
      "type": "object"
    },
    "OfferingKey": {
      "additionalProperties": false,
      "description": "Identity grain for a routable candidate, narrower than model name.",
      "properties": {
        "offering_id": {
          "minLength": 1,
          "title": "Offering Id",
          "type": "string"
        },
        "model_id": {
          "minLength": 1,
          "title": "Model Id",
          "type": "string"
        },
        "provider": {
          "minLength": 1,
          "title": "Provider",
          "type": "string"
        },
        "endpoint": {
          "anyOf": [
            {
              "type": "string"
            },
            {
              "type": "null"
            }
          ],
          "default": null,
          "title": "Endpoint"
        },
        "billing_mode": {
          "anyOf": [
            {
              "type": "string"
            },
            {
              "type": "null"
            }
          ],
          "default": null,
          "title": "Billing Mode"
        },
        "region": {
          "anyOf": [
            {
              "type": "string"
            },
            {
              "type": "null"
            }
          ],
          "default": null,
          "title": "Region"
        },
        "service_tier": {
          "anyOf": [
            {
              "type": "string"
            },
            {
              "type": "null"
            }
          ],
          "default": null,
          "title": "Service Tier"
        },
        "quantization": {
          "anyOf": [
            {
              "type": "string"
            },
            {
              "type": "null"
            }
          ],
          "default": null,
          "title": "Quantization"
        },
        "reasoning_effort": {
          "anyOf": [
            {
              "type": "string"
            },
            {
              "type": "null"
            }
          ],
          "default": null,
          "title": "Reasoning Effort"
        },
        "agent_harness": {
          "anyOf": [
            {
              "type": "string"
            },
            {
              "type": "null"
            }
          ],
          "default": null,
          "title": "Agent Harness"
        },
        "capabilities": {
          "default": [],
          "items": {
            "maxLength": 64,
            "minLength": 1,
            "pattern": "^[a-z][a-z0-9]*(?:[._:/-][a-z0-9]+)*$",
            "type": "string"
          },
          "maxItems": 128,
          "title": "Capabilities",
          "type": "array"
        }
      },
      "required": [
        "offering_id",
        "model_id",
        "provider"
      ],
      "title": "OfferingKey",
      "type": "object"
    },
    "SourceReference": {
      "additionalProperties": false,
      "properties": {
        "id": {
          "minLength": 1,
          "title": "Id",
          "type": "string"
        },
        "version": {
          "anyOf": [
            {
              "type": "string"
            },
            {
              "type": "null"
            }
          ],
          "default": null,
          "title": "Version"
        },
        "url": {
          "anyOf": [
            {
              "format": "uri",
              "maxLength": 2083,
              "pattern": "^https?://[^@?#]+$",
              "type": "string"
            },
            {
              "type": "null"
            }
          ],
          "default": null,
          "title": "Url"
        },
        "terms_url": {
          "anyOf": [
            {
              "format": "uri",
              "maxLength": 2083,
              "pattern": "^https?://[^@?#]+$",
              "type": "string"
            },
            {
              "type": "null"
            }
          ],
          "default": null,
          "title": "Terms Url"
        },
        "license": {
          "anyOf": [
            {
              "type": "string"
            },
            {
              "type": "null"
            }
          ],
          "default": null,
          "title": "License"
        },
        "methodology": {
          "anyOf": [
            {
              "type": "string"
            },
            {
              "type": "null"
            }
          ],
          "default": null,
          "title": "Methodology"
        },
        "raw_sha256": {
          "anyOf": [
            {
              "pattern": "^[0-9a-f]{64}$",
              "type": "string"
            },
            {
              "type": "null"
            }
          ],
          "default": null,
          "title": "Raw Sha256"
        },
        "retrieved_at": {
          "anyOf": [
            {
              "format": "date-time",
              "type": "string"
            },
            {
              "type": "null"
            }
          ],
          "default": null,
          "title": "Retrieved At"
        }
      },
      "required": [
        "id"
      ],
      "title": "SourceReference",
      "type": "object"
    },
    "WorkloadReference": {
      "additionalProperties": false,
      "properties": {
        "id": {
          "minLength": 1,
          "title": "Id",
          "type": "string"
        },
        "version": {
          "minLength": 1,
          "title": "Version",
          "type": "string"
        },
        "unit": {
          "minLength": 1,
          "title": "Unit",
          "type": "string"
        }
      },
      "required": [
        "id",
        "version",
        "unit"
      ],
      "title": "WorkloadReference",
      "type": "object"
    }
  },
  "additionalProperties": false,
  "properties": {
    "schema_version": {
      "const": "model-skyline/v1alpha1",
      "default": "model-skyline/v1alpha1",
      "title": "Schema Version",
      "type": "string"
    },
    "kind": {
      "const": "selection",
      "default": "selection",
      "title": "Kind",
      "type": "string"
    },
    "hash_algorithm": {
      "const": "sha256-rfc8785-v1",
      "default": "sha256-rfc8785-v1",
      "title": "Hash Algorithm",
      "type": "string"
    },
    "snapshot_id": {
      "title": "Snapshot Id",
      "type": "string"
    },
    "policy_hash": {
      "title": "Policy Hash",
      "type": "string"
    },
    "frontier_snapshot_id": {
      "title": "Frontier Snapshot Id",
      "type": "string"
    },
    "selection_id": {
      "title": "Selection Id",
      "type": "string"
    },
    "frontier_id": {
      "title": "Frontier Id",
      "type": "string"
    },
    "workload": {
      "$ref": "#/$defs/WorkloadReference"
    },
    "strategy": {
      "const": "lexicographic",
      "default": "lexicographic",
      "title": "Strategy",
      "type": "string"
    },
    "order_by": {
      "title": "Order By",
      "type": "string"
    },
    "requested_count": {
      "maximum": 10000,
      "minimum": 1,
      "title": "Requested Count",
      "type": "integer"
    },
    "max_per_provider": {
      "anyOf": [
        {
          "maximum": 10000,
          "minimum": 1,
          "type": "integer"
        },
        {
          "type": "null"
        }
      ],
      "default": null,
      "title": "Max Per Provider"
    },
    "on_insufficient": {
      "$ref": "#/$defs/InsufficientCandidates"
    },
    "generated_at": {
      "format": "date-time",
      "title": "Generated At",
      "type": "string"
    },
    "valid_until": {
      "format": "date-time",
      "title": "Valid Until",
      "type": "string"
    },
    "default": {
      "$ref": "#/$defs/ModelChoice"
    },
    "fallbacks": {
      "default": [],
      "items": {
        "$ref": "#/$defs/ModelChoice"
      },
      "title": "Fallbacks",
      "type": "array"
    }
  },
  "required": [
    "snapshot_id",
    "policy_hash",
    "frontier_snapshot_id",
    "selection_id",
    "frontier_id",
    "workload",
    "order_by",
    "requested_count",
    "on_insufficient",
    "generated_at",
    "valid_until",
    "default"
  ],
  "title": "SelectionSnapshot",
  "type": "object"
}
